{"seed":"urbe-small:p15","building":{"id":"p15","type":"restaurant","tier":"high_rich"},"materialTheme":"cyberpunk","blueprint":{"buildingId":"p15","seed":"urbe-small:p15","facade":{"style":"glass","panelModule":3},"floors":[{"index":-1,"kind":"basement","elevation":-4,"height":4,"outline":[[310.956,264.748],[321.425,291.049],[321.915,291.983],[331.93,306.949],[302.526,321.949],[301.476,320.485],[282.958,286.541],[278.343,274.833],[284.592,272.6],[310.851,264.699],[310.921,264.689]],"openings":[{"id":"l119a","kind":"aperture","edge":0,"offset":12.654,"width":3.0009944181465755,"height":2.8,"sill":0,"apertureKind":"tunnel","material":"cyberpunk/aperture-frame/high_rich"}]},{"index":0,"kind":"restaurant","elevation":0,"height":4.3,"outline":[[310.956,264.748],[321.425,291.049],[321.915,291.983],[331.93,306.949],[302.526,321.949],[301.476,320.485],[282.958,286.541],[278.343,274.833],[284.592,272.6],[310.851,264.699],[310.921,264.689]],"openings":[{"id":"entrance","kind":"door","edge":0,"offset":0.6,"width":3.9,"height":3.3,"sill":0,"leaves":4,"material":"cyberpunk/door-glass/high_rich"},{"id":"w:0:0:2","kind":"window","edge":0,"offset":7.527,"width":3.1,"height":3.8,"sill":0.15,"state":"closed80","panes":{"cols":2,"rows":2},"material":"cyberpunk/window-glass/high_rich"},{"id":"w:0:0:4","kind":"window","edge":0,"offset":14.304,"width":3.1,"height":3.8,"sill":0.15,"state":"closed80","panes":{"cols":2,"rows":2},"material":"cyberpunk/window-glass/high_rich"},{"id":"w:0:0:5","kind":"window","edge":0,"offset":17.692,"width":3.1,"height":3.8,"sill":0.15,"state":"closed80","panes":{"cols":2,"rows":2},"material":"cyberpunk/window-glass/high_rich"},{"id":"w:0:0:6","kind":"window","edge":0,"offset":21.081,"width":3.1,"height":3.8,"sill":0.15,"state":"half","panes":{"cols":2,"rows":2},"material":"cyberpunk/window-glass/high_rich"},{"id":"w:0:0:7","kind":"window","edge":0,"offset":24.469,"width":3.1,"height":3.8,"sill":0.15,"state":"half","panes":{"cols":2,"rows":2},"material":"cyberpunk/window-glass/high_rich"},{"id":"w:0:2:0","kind":"window","edge":2,"offset":0.75,"width":3.05,"height":3.8,"sill":0.15,"state":"open","panes":{"cols":2,"rows":2},"material":"cyberpunk/window-glass/high_rich"},{"id":"w:0:2:1","kind":"window","edge":2,"offset":4.112,"width":3.05,"height":3.8,"sill":0.15,"state":"open","panes":{"cols":2,"rows":2},"material":"cyberpunk/window-glass/high_rich"},{"id":"w:0:2:2","kind":"window","edge":2,"offset":7.473,"width":3.05,"height":3.8,"sill":0.15,"state":"half","panes":{"cols":2,"rows":2},"material":"cyberpunk/window-glass/high_rich"},{"id":"w:0:2:4","kind":"window","edge":2,"offset":14.196,"width":3.05,"height":3.8,"sill":0.15,"state":"open","panes":{"cols":2,"rows":2},"material":"cyberpunk/window-glass/high_rich"},{"id":"w:0:3:0","kind":"window","edge":3,"offset":0.75,"width":3.25,"height":3.8,"sill":0.15,"state":"closed80","panes":{"cols":2,"rows":2},"material":"cyberpunk/window-glass/high_rich"},{"id":"w:0:3:1","kind":"window","edge":3,"offset":4.284,"width":3.25,"height":3.8,"sill":0.15,"state":"closed80","panes":{"cols":2,"rows":2},"material":"cyberpunk/window-glass/high_rich"},{"id":"w:0:3:3","kind":"window","edge":3,"offset":11.353,"width":3.25,"height":3.8,"sill":0.15,"state":"half","panes":{"cols":2,"rows":2},"material":"cyberpunk/window-glass/high_rich"},{"id":"w:0:3:5","kind":"window","edge":3,"offset":18.422,"width":3.25,"height":3.8,"sill":0.15,"state":"closed80","panes":{"cols":2,"rows":2},"material":"cyberpunk/window-glass/high_rich"},{"id":"w:0:3:6","kind":"window","edge":3,"offset":21.956,"width":3.25,"height":3.8,"sill":0.15,"state":"open","panes":{"cols":2,"rows":2},"material":"cyberpunk/window-glass/high_rich"},{"id":"w:0:3:7","kind":"window","edge":3,"offset":25.49,"width":3.25,"height":3.8,"sill":0.15,"state":"open","panes":{"cols":2,"rows":2},"material":"cyberpunk/window-glass/high_rich"},{"id":"w:0:3:8","kind":"window","edge":3,"offset":29.025,"width":3.25,"height":3.8,"sill":0.15,"state":"closed80","panes":{"cols":2,"rows":2},"material":"cyberpunk/window-glass/high_rich"},{"id":"w:0:5:0","kind":"window","edge":5,"offset":0.75,"width":3.1,"height":3.8,"sill":0.15,"state":"half","panes":{"cols":2,"rows":2},"material":"cyberpunk/window-glass/high_rich"},{"id":"w:0:5:1","kind":"window","edge":5,"offset":4.156,"width":3.1,"height":3.8,"sill":0.15,"state":"half","panes":{"cols":2,"rows":2},"material":"cyberpunk/window-glass/high_rich"},{"id":"w:0:5:3","kind":"window","edge":5,"offset":10.968,"width":3.1,"height":3.8,"sill":0.15,"state":"half","panes":{"cols":2,"rows":2},"material":"cyberpunk/window-glass/high_rich"},{"id":"w:0:5:5","kind":"window","edge":5,"offset":17.78,"width":3.1,"height":3.8,"sill":0.15,"state":"closed80","panes":{"cols":2,"rows":2},"material":"cyberpunk/window-glass/high_rich"},{"id":"w:0:5:6","kind":"window","edge":5,"offset":21.186,"width":3.1,"height":3.8,"sill":0.15,"state":"open","panes":{"cols":2,"rows":2},"material":"cyberpunk/window-glass/high_rich"},{"id":"w:0:5:7","kind":"window","edge":5,"offset":24.592,"width":3.1,"height":3.8,"sill":0.15,"state":"open","panes":{"cols":2,"rows":2},"material":"cyberpunk/window-glass/high_rich"},{"id":"w:0:5:8","kind":"window","edge":5,"offset":27.998,"width":3.1,"height":3.8,"sill":0.15,"state":"half","panes":{"cols":2,"rows":2},"material":"cyberpunk/window-glass/high_rich"},{"id":"w:0:5:9","kind":"window","edge":5,"offset":31.405,"width":3.1,"height":3.8,"sill":0.15,"state":"half","panes":{"cols":2,"rows":2},"material":"cyberpunk/window-glass/high_rich"},{"id":"w:0:5:10","kind":"window","edge":5,"offset":34.811,"width":3.1,"height":3.8,"sill":0.15,"state":"closed80","panes":{"cols":2,"rows":2},"material":"cyberpunk/window-glass/high_rich"},{"id":"w:0:6:0","kind":"window","edge":6,"offset":0.75,"width":3.5,"height":3.8,"sill":0.15,"state":"closed80","panes":{"cols":2,"rows":2},"material":"cyberpunk/window-glass/high_rich"},{"id":"w:0:6:1","kind":"window","edge":6,"offset":4.545,"width":3.5,"height":3.8,"sill":0.15,"state":"closed80","panes":{"cols":2,"rows":2},"material":"cyberpunk/window-glass/high_rich"},{"id":"w:0:7:0","kind":"window","edge":7,"offset":0.75,"width":2.4,"height":3.8,"sill":0.15,"state":"closed80","panes":{"cols":2,"rows":2},"material":"cyberpunk/window-glass/high_rich"},{"id":"w:0:7:1","kind":"window","edge":7,"offset":3.468,"width":2.4,"height":3.8,"sill":0.15,"state":"closed80","panes":{"cols":2,"rows":2},"material":"cyberpunk/window-glass/high_rich"},{"id":"w:0:8:0","kind":"window","edge":8,"offset":0.75,"width":3,"height":3.8,"sill":0.15,"state":"open","panes":{"cols":2,"rows":2},"material":"cyberpunk/window-glass/high_rich"},{"id":"w:0:8:1","kind":"window","edge":8,"offset":4.028,"width":3,"height":3.8,"sill":0.15,"state":"open","panes":{"cols":2,"rows":2},"material":"cyberpunk/window-glass/high_rich"},{"id":"w:0:8:3","kind":"window","edge":8,"offset":10.583,"width":3,"height":3.8,"sill":0.15,"state":"half","panes":{"cols":2,"rows":2},"material":"cyberpunk/window-glass/high_rich"},{"id":"w:0:8:5","kind":"window","edge":8,"offset":17.139,"width":3,"height":3.8,"sill":0.15,"state":"half","panes":{"cols":2,"rows":2},"material":"cyberpunk/window-glass/high_rich"},{"id":"w:0:8:6","kind":"window","edge":8,"offset":20.416,"width":3,"height":3.8,"sill":0.15,"state":"closed80","panes":{"cols":2,"rows":2},"material":"cyberpunk/window-glass/high_rich"},{"id":"w:0:8:7","kind":"window","edge":8,"offset":23.694,"width":3,"height":3.8,"sill":0.15,"state":"closed80","panes":{"cols":2,"rows":2},"material":"cyberpunk/window-glass/high_rich"}]}]}}
